{
  "base_continuity": {
    "files": {
      "evidence/base-ai-blackout.json": "914cbf991e6715e349a4bdb084c05a735aec7690f6d81db88e7c157d31564426",
      "evidence/base-base-transfer-contract.json": "7d32d67b6575e4d1864fc88fcd785d3dac54759aca873df70f91139d2050e463",
      "evidence/base-crash-matrix.json": "662624e0fab67c66f952e4575b0bb632fff0ada6ebe1b639511f4a334d387885"
    },
    "observations": {
      "evidence/base-ai-blackout.json": {
        "rollback": "PASS",
        "runs": 1
      },
      "evidence/base-base-transfer-contract.json": {
        "rollback": "PASS",
        "runs": 1
      },
      "evidence/base-crash-matrix.json": {
        "rollback": "PASS",
        "runs": 1
      }
    },
    "ordinary_base_live": true,
    "rollback_verified": true
  },
  "checks": [
    {
      "detail": "{\"command\":[\"cargo\",\"test\",\"--locked\",\"-p\",\"noos-nel\",\"--\",\"--test-threads=1\"],\"exit_code\":0,\"packages\":[\"noos-nel\"]}",
      "id": "claim-implementation",
      "kind": "implementation",
      "passed": true
    },
    {
      "detail": "{\"command\":[\"cargo\",\"test\",\"--locked\",\"-p\",\"noos-nel\",\"--\",\"--test-threads=1\"],\"exit_code\":0,\"packages\":[\"noos-nel\"]}",
      "id": "claim-falsifiers",
      "kind": "falsifier",
      "passed": true
    },
    {
      "detail": "{\"ordinary_base_live\":true,\"rollback_verified\":true}",
      "id": "ordinary-base-rollback",
      "kind": "rollback",
      "passed": true
    }
  ],
  "claim_fingerprints": {
    "E-NEL-01b": "59e50e32f2897e46ebb092a938fc25bef1c838845d8d310b0f9d3d79de9dd6b8"
  },
  "claims": [
    "E-NEL-01b"
  ],
  "command": [
    "tools/gates/run_implementation_claim.py",
    "--claim",
    "E-NEL-01b"
  ],
  "evidence_sha256": "a668f0ce200fb2fb77ba34fece458a976cc751eb6eda47a6aa6ddba1aaa12518",
  "expected_result": "IMPLEMENTED",
  "gate": "implementation-e-nel-01b",
  "limitations": [
    "This is local implementation evidence, not independent or production evidence."
  ],
  "registry_schema_version": "1.2.0",
  "result": "IMPLEMENTED",
  "schema_version": "noos.experimental-evidence.v2",
  "source_binding": {
    "entries": [
      {
        "bytes": 429,
        "git_blob": "7a954926e26e7cbf65583fc303e8783a4f31278f",
        "git_mode": "100644",
        "path": "crates/noos-nel/Cargo.toml",
        "sha256": "8c7b800d955e17d2d2d2f67c65803308a357cf25bb218a9e7f4691500b10d7d5"
      },
      {
        "bytes": 39268,
        "git_blob": "6497aa73fccc6398f42d68a07d12e37411df4c2d",
        "git_mode": "100644",
        "path": "crates/noos-nel/src/lib.rs",
        "sha256": "4734b070c11b19833caae788a249b5f227f074133c0264fe58b957a4b5c328a0"
      },
      {
        "bytes": 3054,
        "git_blob": "2001603917f8e5c9b1817ec4062f89d3264e204a",
        "git_mode": "100644",
        "path": "protocol/claims/experimental-evidence-schema-v2.json",
        "sha256": "33294bf6d8cf33ec29b1277b633adf9e2f826b39dee4fbd43c621249b19b12b9"
      },
      {
        "bytes": 11625,
        "git_blob": "d8bf109b3a095e7a9ec013ee63e7a5be5820a06e",
        "git_mode": "100644",
        "path": "tools/gates/experimental_gate.py",
        "sha256": "de98b15db02c5bef2076dfcb1c3725ca9367341325cea0ba1ef31a1569bbdbfd"
      },
      {
        "bytes": 17330,
        "git_blob": "bb48c14b2d6445e00526b88264ef9a2fdbc8a87b",
        "git_mode": "100644",
        "path": "tools/gates/run_claim_matrix.py",
        "sha256": "c3be6f49ed227643dc49dfac6d75f5f3626df6c7c45cb9b677ee2d93ac251a6f"
      },
      {
        "bytes": 4001,
        "git_blob": "3a9320d991dba39a348dea0b43cf974122537ff2",
        "git_mode": "100644",
        "path": "tools/gates/run_implementation_claim.py",
        "sha256": "f1754f72a93943b1e11fd838d920479474b9d1a59344bb1af9b5f9493872e44f"
      }
    ],
    "manifest_sha256": "16c8b18264f195b3bc1e0d61297027faa820d76097d43d969d8a2cd644cb7c64",
    "source_revision": "8daf7dad6ad80554809dfe911cb54a8798533272",
    "source_tree": "92967ca0e8c0f2bbd5b3a2950bf220deb08dfdf8"
  }
}
