{
  "base_continuity": {
    "files": {
      "evidence/base-ai-blackout.json": "914cbf991e6715e349a4bdb084c05a735aec7690f6d81db88e7c157d31564426",
      "evidence/base-base-transfer-contract.json": "7d32d67b6575e4d1864fc88fcd785d3dac54759aca873df70f91139d2050e463",
      "evidence/base-crash-matrix.json": "662624e0fab67c66f952e4575b0bb632fff0ada6ebe1b639511f4a334d387885"
    },
    "observations": {
      "evidence/base-ai-blackout.json": {
        "rollback": "PASS",
        "runs": 1
      },
      "evidence/base-base-transfer-contract.json": {
        "rollback": "PASS",
        "runs": 1
      },
      "evidence/base-crash-matrix.json": {
        "rollback": "PASS",
        "runs": 1
      }
    },
    "ordinary_base_live": true,
    "rollback_verified": true
  },
  "checks": [
    {
      "detail": "{\"command\":[\"cargo\",\"test\",\"--locked\",\"-p\",\"noos-weft-check\",\"--\",\"--test-threads=1\"],\"exit_code\":0,\"packages\":[\"noos-weft-check\"]}",
      "id": "claim-implementation",
      "kind": "implementation",
      "passed": true
    },
    {
      "detail": "{\"command\":[\"cargo\",\"test\",\"--locked\",\"-p\",\"noos-weft-check\",\"--\",\"--test-threads=1\"],\"exit_code\":0,\"packages\":[\"noos-weft-check\"]}",
      "id": "claim-falsifiers",
      "kind": "falsifier",
      "passed": true
    },
    {
      "detail": "{\"ordinary_base_live\":true,\"rollback_verified\":true}",
      "id": "ordinary-base-rollback",
      "kind": "rollback",
      "passed": true
    }
  ],
  "claim_fingerprints": {
    "E-WEFT-01a": "676e86ca6529ca0963d5f165bc468f1d21160d3c7fef6027465b125afade46ee"
  },
  "claims": [
    "E-WEFT-01a"
  ],
  "command": [
    "tools/gates/run_implementation_claim.py",
    "--claim",
    "E-WEFT-01a"
  ],
  "evidence_sha256": "74be8d09b98ae09b049f126df840bb274a64c1d95f3a1fe4b68b3b5ce0a88089",
  "expected_result": "IMPLEMENTED",
  "gate": "implementation-e-weft-01a",
  "limitations": [
    "This is local implementation evidence, not independent or production evidence."
  ],
  "registry_schema_version": "1.2.0",
  "result": "IMPLEMENTED",
  "schema_version": "noos.experimental-evidence.v2",
  "source_binding": {
    "entries": [
      {
        "bytes": 674,
        "git_blob": "f188482c9d79b121dedc8129971108b4abda3bdd",
        "git_mode": "100644",
        "path": "crates/noos-weft-check/Cargo.toml",
        "sha256": "788971fd9433f8ef8ae2eea702679ca67f551aefc3cc298f63d19e13b0aec299"
      },
      {
        "bytes": 21771,
        "git_blob": "146d027007023e8e295fb011b92328fb363d2c26",
        "git_mode": "100644",
        "path": "crates/noos-weft-check/src/lib.rs",
        "sha256": "ef4b59fee60d8166adb4d9126ec2aacfa9e0d4c8155a638fe0334d3fb286a634"
      },
      {
        "bytes": 3054,
        "git_blob": "2001603917f8e5c9b1817ec4062f89d3264e204a",
        "git_mode": "100644",
        "path": "protocol/claims/experimental-evidence-schema-v2.json",
        "sha256": "33294bf6d8cf33ec29b1277b633adf9e2f826b39dee4fbd43c621249b19b12b9"
      },
      {
        "bytes": 25779,
        "git_blob": "1724fc0f3deeb0b35558a411c2b2ef802ba39f52",
        "git_mode": "100644",
        "path": "protocol/schemas/weft-v0.md",
        "sha256": "e474a2beab40d1994f83a487a6a7a749d756e9dad7d1ba608402ad63c111341f"
      },
      {
        "bytes": 18346,
        "git_blob": "cf6f309cc6ab564498740474829cd523eee78796",
        "git_mode": "100644",
        "path": "protocol/vectors/weft/weft-cost-v0.json",
        "sha256": "e2733f5c6d2f81efb0ce6bd6547ff950f09f483b1e3db40914427928a01ffed2"
      },
      {
        "bytes": 6571,
        "git_blob": "768feea349e7511e939fb80d0abcae839ad3e5cc",
        "git_mode": "100644",
        "path": "protocol/vectors/weft/weft-profile-v0.json",
        "sha256": "2391f6408ef2edf2adb2e65bd2878181f27be5db13988e3d8c8e233c95bde971"
      },
      {
        "bytes": 43130,
        "git_blob": "b897d0547714754253ee78db15003902952b134d",
        "git_mode": "100644",
        "path": "protocol/vectors/weft/weft-refs-v0.json",
        "sha256": "dfb0f1c1abd23a969e6dcf600576b2c5bdbdae400e691a00a4daf1a7b299604f"
      },
      {
        "bytes": 11625,
        "git_blob": "d8bf109b3a095e7a9ec013ee63e7a5be5820a06e",
        "git_mode": "100644",
        "path": "tools/gates/experimental_gate.py",
        "sha256": "de98b15db02c5bef2076dfcb1c3725ca9367341325cea0ba1ef31a1569bbdbfd"
      },
      {
        "bytes": 17330,
        "git_blob": "bb48c14b2d6445e00526b88264ef9a2fdbc8a87b",
        "git_mode": "100644",
        "path": "tools/gates/run_claim_matrix.py",
        "sha256": "c3be6f49ed227643dc49dfac6d75f5f3626df6c7c45cb9b677ee2d93ac251a6f"
      },
      {
        "bytes": 4001,
        "git_blob": "3a9320d991dba39a348dea0b43cf974122537ff2",
        "git_mode": "100644",
        "path": "tools/gates/run_implementation_claim.py",
        "sha256": "f1754f72a93943b1e11fd838d920479474b9d1a59344bb1af9b5f9493872e44f"
      }
    ],
    "manifest_sha256": "132df73d3a1c5d7044e1eee58c7040b5a3227a078682d6f5748ec9ad9c73d14c",
    "source_revision": "8daf7dad6ad80554809dfe911cb54a8798533272",
    "source_tree": "92967ca0e8c0f2bbd5b3a2950bf220deb08dfdf8"
  }
}
