{
  "base_continuity": {
    "files": {
      "evidence/base-ai-blackout.json": "914cbf991e6715e349a4bdb084c05a735aec7690f6d81db88e7c157d31564426",
      "evidence/base-base-transfer-contract.json": "7d32d67b6575e4d1864fc88fcd785d3dac54759aca873df70f91139d2050e463",
      "evidence/base-crash-matrix.json": "662624e0fab67c66f952e4575b0bb632fff0ada6ebe1b639511f4a334d387885"
    },
    "observations": {
      "evidence/base-ai-blackout.json": {
        "rollback": "PASS",
        "runs": 1
      },
      "evidence/base-base-transfer-contract.json": {
        "rollback": "PASS",
        "runs": 1
      },
      "evidence/base-crash-matrix.json": {
        "rollback": "PASS",
        "runs": 1
      }
    },
    "ordinary_base_live": true,
    "rollback_verified": true
  },
  "checks": [
    {
      "detail": "{\"command\":[\"cargo\",\"test\",\"--locked\",\"-p\",\"noos-reflex\",\"--\",\"--test-threads=1\"],\"exit_code\":0,\"packages\":[\"noos-reflex\"]}",
      "id": "claim-implementation",
      "kind": "implementation",
      "passed": true
    },
    {
      "detail": "{\"command\":[\"cargo\",\"test\",\"--locked\",\"-p\",\"noos-reflex\",\"--\",\"--test-threads=1\"],\"exit_code\":0,\"packages\":[\"noos-reflex\"]}",
      "id": "claim-falsifiers",
      "kind": "falsifier",
      "passed": true
    },
    {
      "detail": "{\"ordinary_base_live\":true,\"rollback_verified\":true}",
      "id": "ordinary-base-rollback",
      "kind": "rollback",
      "passed": true
    }
  ],
  "claim_fingerprints": {
    "E-REFLEX-02": "d704050dcc15cafed91c1c5f19020016c6bf9ba6a66c604d45aeb491ae4cd4a2"
  },
  "claims": [
    "E-REFLEX-02"
  ],
  "command": [
    "tools/gates/run_implementation_claim.py",
    "--claim",
    "E-REFLEX-02"
  ],
  "evidence_sha256": "7929be6357f03e9a4cc155bd63c6d5df8e69daa7dda2ff747a76c1b830216c43",
  "expected_result": "IMPLEMENTED",
  "gate": "implementation-e-reflex-02",
  "limitations": [
    "This is local implementation evidence, not independent or production evidence."
  ],
  "registry_schema_version": "1.2.0",
  "result": "IMPLEMENTED",
  "schema_version": "noos.experimental-evidence.v2",
  "source_binding": {
    "entries": [
      {
        "bytes": 610,
        "git_blob": "6b4f7cf2b7cab0524675789d67e65077175d72ab",
        "git_mode": "100644",
        "path": "crates/noos-reflex/Cargo.toml",
        "sha256": "f947bf21e9789a7124212b141949b5d41d95544ade491c6caf07c6b33023c581"
      },
      {
        "bytes": 40834,
        "git_blob": "655e0c4b9cbf58162251f8c34552e6f3f8b35589",
        "git_mode": "100644",
        "path": "crates/noos-reflex/src/lib.rs",
        "sha256": "2f2977f64306c1d44c7d78ece6ad56f95e6e38850db961b6da7aae2012b1cc19"
      },
      {
        "bytes": 3054,
        "git_blob": "2001603917f8e5c9b1817ec4062f89d3264e204a",
        "git_mode": "100644",
        "path": "protocol/claims/experimental-evidence-schema-v2.json",
        "sha256": "33294bf6d8cf33ec29b1277b633adf9e2f826b39dee4fbd43c621249b19b12b9"
      },
      {
        "bytes": 11625,
        "git_blob": "d8bf109b3a095e7a9ec013ee63e7a5be5820a06e",
        "git_mode": "100644",
        "path": "tools/gates/experimental_gate.py",
        "sha256": "de98b15db02c5bef2076dfcb1c3725ca9367341325cea0ba1ef31a1569bbdbfd"
      },
      {
        "bytes": 17330,
        "git_blob": "bb48c14b2d6445e00526b88264ef9a2fdbc8a87b",
        "git_mode": "100644",
        "path": "tools/gates/run_claim_matrix.py",
        "sha256": "c3be6f49ed227643dc49dfac6d75f5f3626df6c7c45cb9b677ee2d93ac251a6f"
      },
      {
        "bytes": 4001,
        "git_blob": "3a9320d991dba39a348dea0b43cf974122537ff2",
        "git_mode": "100644",
        "path": "tools/gates/run_implementation_claim.py",
        "sha256": "f1754f72a93943b1e11fd838d920479474b9d1a59344bb1af9b5f9493872e44f"
      }
    ],
    "manifest_sha256": "c2e99cefe8af875b26c845726b439fdb0688e5fbfcf440555b73a69fed1b01ef",
    "source_revision": "8daf7dad6ad80554809dfe911cb54a8798533272",
    "source_tree": "92967ca0e8c0f2bbd5b3a2950bf220deb08dfdf8"
  }
}
