{
  "base_continuity": {
    "files": {
      "evidence/base-ai-blackout.json": "914cbf991e6715e349a4bdb084c05a735aec7690f6d81db88e7c157d31564426",
      "evidence/base-base-transfer-contract.json": "7d32d67b6575e4d1864fc88fcd785d3dac54759aca873df70f91139d2050e463",
      "evidence/base-crash-matrix.json": "662624e0fab67c66f952e4575b0bb632fff0ada6ebe1b639511f4a334d387885"
    },
    "observations": {
      "evidence/base-ai-blackout.json": {
        "rollback": "PASS",
        "runs": 1
      },
      "evidence/base-base-transfer-contract.json": {
        "rollback": "PASS",
        "runs": 1
      },
      "evidence/base-crash-matrix.json": {
        "rollback": "PASS",
        "runs": 1
      }
    },
    "ordinary_base_live": true,
    "rollback_verified": true
  },
  "checks": [
    {
      "detail": "[{\"command\":[\"cargo\",\"test\",\"--locked\",\"-p\",\"noos-nel\",\"--\",\"--test-threads=1\"],\"exit_code\":0,\"packages\":[\"noos-nel\"]},{\"command\":[\"cargo\",\"run\",\"--locked\",\"-q\",\"-p\",\"noos-nel\",\"--bin\",\"nel-claim-harness\",\"--\",\"N-PROFILE\"],\"metrics\":{\"claim\":\"N-PROFILE\",\"cobatch_mismatches\":0,\"contract_mutations_rejected\":true,\"invalid_tokenizer_bytes_rejected\":true,\"matmul_instances\":297,\"profile_id\":\"748ee5e4dabc6ffe6eddbcb8b511a30679380bc0a7bd64e42435f6a3ec2787aa\",\"schedule_mismatches\":0,\"semantic_op_families\":17,\"tokenizer_root\":\"8bfd22d554df63b97dad72c0a51ca40934a177f9673c6b1c2ba918c96c905eb6\"}},{\"local_command\":\"python tools/gates/run_nel_lab_claim.py --claim N-PROFILE\",\"required_external\":[\"registered Qwen2.5-0.5B source checkpoint and tokenizer byte specification\",\"at least 1000000000 clean operator instances\",\"two independently authored CPU references\",\"certified AMD and NVIDIA integer kernels\",\"preregistered real-model quality tolerance\"]}]",
      "id": "local-precursor",
      "kind": "falsifier",
      "passed": true
    },
    {
      "detail": "[\"registered Qwen2.5-0.5B source checkpoint and tokenizer byte specification\",\"at least 1000000000 clean operator instances\",\"two independently authored CPU references\",\"certified AMD and NVIDIA integer kernels\",\"preregistered real-model quality tolerance\"]",
      "id": "external-pass-threshold",
      "kind": "external_requirement",
      "passed": false
    },
    {
      "detail": "{\"ordinary_base_live\":true,\"rollback_verified\":true}",
      "id": "ordinary-base-rollback",
      "kind": "rollback",
      "passed": true
    }
  ],
  "claim_fingerprints": {
    "N-PROFILE": "583f42f4972a54d3d980044efbd2e6b7db252fb0b264438ca1ec14ee51c03c21"
  },
  "claims": [
    "N-PROFILE"
  ],
  "command": [
    "tools/gates/run_nel_lab_claim.py",
    "--claim",
    "N-PROFILE"
  ],
  "evidence_sha256": "0968922e3d8b1b5b8f76547d36873e3434e6dccca6de573130657a2a2f1a5a87",
  "expected_result": "EXTERNAL_BLOCKED",
  "gate": "implementation-n-profile",
  "limitations": [
    "Local deterministic evidence only; it is not independent, cross-vendor, public-duration, or production evidence.",
    "registered Qwen2.5-0.5B source checkpoint and tokenizer byte specification",
    "at least 1000000000 clean operator instances",
    "two independently authored CPU references",
    "certified AMD and NVIDIA integer kernels",
    "preregistered real-model quality tolerance"
  ],
  "registry_schema_version": "1.2.0",
  "result": "EXTERNAL_BLOCKED",
  "schema_version": "noos.experimental-evidence.v2",
  "source_binding": {
    "entries": [
      {
        "bytes": 371,
        "git_blob": "9871a6f0a90c697f06d0ed71bddc9e8b253ef7ce",
        "git_mode": "100644",
        "path": "crates/noos-nel/Cargo.toml",
        "sha256": "17d2ecfb2e392c496e7dfaa14c28d1b89a4b97a16095b984434f3b81cfc99189"
      },
      {
        "bytes": 3743,
        "git_blob": "778914d50d68c69c1e82c0d5b324972280469432",
        "git_mode": "100644",
        "path": "crates/noos-nel/fixtures/claim-prerequisites-v1.json",
        "sha256": "2cc557d30d64431df6fcaa777b659b016719e61fc86abf166d261015137a6f94"
      },
      {
        "bytes": 8823,
        "git_blob": "fb3bd2dbddba68abc9689e30fb73c2524068f371",
        "git_mode": "100644",
        "path": "crates/noos-nel/src/bin/nel-claim-harness.rs",
        "sha256": "f69ce157e76130d4fe4eb7cd650369bdcef58f67e9082f1212407feacc0bc6ca"
      },
      {
        "bytes": 65903,
        "git_blob": "9cf848f4454a5b2add01b80046122ed8273e32a7",
        "git_mode": "100644",
        "path": "crates/noos-nel/src/inference.rs",
        "sha256": "304f6746a5b2bd9ba23e73a06553caac95b5c211c39377a50343ed4454b982c8"
      },
      {
        "bytes": 46653,
        "git_blob": "110f4e9590cf4a96842fc30aa131f19b146219da",
        "git_mode": "100644",
        "path": "crates/noos-nel/src/lab.rs",
        "sha256": "68edd26a91d6facfe7f8051bdb6c351dea0fbc3852d29657ecc1852b2584ce24"
      },
      {
        "bytes": 38873,
        "git_blob": "2114540a276df319614952d783a2627e32a54906",
        "git_mode": "100644",
        "path": "crates/noos-nel/src/lib.rs",
        "sha256": "30c1d4afbb6d1da58f6739b2deeab4d6d8b89a519803fa372ae1a97f2c2ca0a7"
      },
      {
        "bytes": 6333,
        "git_blob": "5ac49ecc0f40d67e4e5f392aab92bdb74d1676a4",
        "git_mode": "100644",
        "path": "crates/noos-nel/src/luts.rs",
        "sha256": "80d6ecea395a61c2d5fe103cd20aad2b8b7608d1442b0dcebb4ec017629c7acb"
      },
      {
        "bytes": 3054,
        "git_blob": "2001603917f8e5c9b1817ec4062f89d3264e204a",
        "git_mode": "100644",
        "path": "protocol/claims/experimental-evidence-schema-v2.json",
        "sha256": "33294bf6d8cf33ec29b1277b633adf9e2f826b39dee4fbd43c621249b19b12b9"
      },
      {
        "bytes": 1632,
        "git_blob": "2f7b7f7ce213c30023749c9039b16abae5654fe8",
        "git_mode": "100644",
        "path": "protocol/vectors/nel/forward-w8a8-v1.json",
        "sha256": "afa7a0ac2466f878cafbb41edc510a04ad595e0ceaac39aabed5c34dd8eeab9a"
      },
      {
        "bytes": 11625,
        "git_blob": "d8bf109b3a095e7a9ec013ee63e7a5be5820a06e",
        "git_mode": "100644",
        "path": "tools/gates/experimental_gate.py",
        "sha256": "de98b15db02c5bef2076dfcb1c3725ca9367341325cea0ba1ef31a1569bbdbfd"
      },
      {
        "bytes": 17231,
        "git_blob": "f0f5b6a103a2e54e76875b2fa03f549cbb49a470",
        "git_mode": "100644",
        "path": "tools/gates/run_claim_matrix.py",
        "sha256": "aae3d806665104ccf870678ac15cb1310fd670a12a422e6100b782c23a9792bd"
      },
      {
        "bytes": 11202,
        "git_blob": "43ddee12e406ad0c526c23fa29c871927dfd1a16",
        "git_mode": "100644",
        "path": "tools/gates/run_nel_lab_claim.py",
        "sha256": "bcf1b60f418568f0cdcbe5912a3a35953f6b7592faf2a813015a32e903e1403c"
      }
    ],
    "manifest_sha256": "42f7b350f42187aaa5d71ec23a007dce61e2dd1089935a3a1d0861d9b8c394e6",
    "source_revision": "eef245431a9d4e569a56fc80248513a6bc3bb512",
    "source_tree": "b3ed02cf7a33c2afe611582b6fd944aa54f1b521"
  }
}
