{
  "base_continuity": {
    "files": {
      "evidence/base-ai-blackout.json": "914cbf991e6715e349a4bdb084c05a735aec7690f6d81db88e7c157d31564426",
      "evidence/base-base-transfer-contract.json": "7d32d67b6575e4d1864fc88fcd785d3dac54759aca873df70f91139d2050e463",
      "evidence/base-crash-matrix.json": "662624e0fab67c66f952e4575b0bb632fff0ada6ebe1b639511f4a334d387885"
    },
    "observations": {
      "evidence/base-ai-blackout.json": {
        "rollback": "PASS",
        "runs": 1
      },
      "evidence/base-base-transfer-contract.json": {
        "rollback": "PASS",
        "runs": 1
      },
      "evidence/base-crash-matrix.json": {
        "rollback": "PASS",
        "runs": 1
      }
    },
    "ordinary_base_live": true,
    "rollback_verified": true
  },
  "checks": [
    {
      "detail": "{\"command\":[\"cargo\",\"test\",\"--locked\",\"-p\",\"noos-braid\",\"--\",\"--test-threads=1\"],\"exit_code\":0,\"packages\":[\"noos-braid\"]}",
      "id": "claim-implementation",
      "kind": "implementation",
      "passed": true
    },
    {
      "detail": "{\"command\":[\"cargo\",\"test\",\"--locked\",\"-p\",\"noos-braid\",\"--\",\"--test-threads=1\"],\"exit_code\":0,\"packages\":[\"noos-braid\"]}",
      "id": "claim-falsifiers",
      "kind": "falsifier",
      "passed": true
    },
    {
      "detail": "{\"ordinary_base_live\":true,\"rollback_verified\":true}",
      "id": "ordinary-base-rollback",
      "kind": "rollback",
      "passed": true
    }
  ],
  "claim_fingerprints": {
    "A-PULSE": "0c653bf37884b338f3758f8baf3f818a5fe2c2b48f1a0cccb12e66d8f3c3b344"
  },
  "claims": [
    "A-PULSE"
  ],
  "command": [
    "tools/gates/run_implementation_claim.py",
    "--claim",
    "A-PULSE"
  ],
  "evidence_sha256": "face6ea8bf2bdbb16da5d93a14666b781d04d871e606067316d2b31a8c2c0b52",
  "expected_result": "IMPLEMENTED",
  "gate": "implementation-a-pulse",
  "limitations": [
    "This is local implementation evidence, not independent or production evidence."
  ],
  "registry_schema_version": "1.2.0",
  "result": "IMPLEMENTED",
  "schema_version": "noos.experimental-evidence.v2",
  "source_binding": {
    "entries": [
      {
        "bytes": 909,
        "git_blob": "c1503c55c9052132bc7baa06b3e2ff3ac5a0500a",
        "git_mode": "100644",
        "path": "crates/noos-braid/Cargo.toml",
        "sha256": "af8febe91195fceee44aeb9aaeb65481d56261caea96cd01018da9d6b9556f4e"
      },
      {
        "bytes": 2743,
        "git_blob": "494a06a3cb21bd78242967fdc870367a640b0d47",
        "git_mode": "100644",
        "path": "crates/noos-braid/src/lib.rs",
        "sha256": "4b12425b42a3dee80b50c2b4439dd9023933340f6902bbca90310a083d1d2a3c"
      },
      {
        "bytes": 3054,
        "git_blob": "2001603917f8e5c9b1817ec4062f89d3264e204a",
        "git_mode": "100644",
        "path": "protocol/claims/experimental-evidence-schema-v2.json",
        "sha256": "33294bf6d8cf33ec29b1277b633adf9e2f826b39dee4fbd43c621249b19b12b9"
      },
      {
        "bytes": 11625,
        "git_blob": "d8bf109b3a095e7a9ec013ee63e7a5be5820a06e",
        "git_mode": "100644",
        "path": "tools/gates/experimental_gate.py",
        "sha256": "de98b15db02c5bef2076dfcb1c3725ca9367341325cea0ba1ef31a1569bbdbfd"
      },
      {
        "bytes": 17330,
        "git_blob": "bb48c14b2d6445e00526b88264ef9a2fdbc8a87b",
        "git_mode": "100644",
        "path": "tools/gates/run_claim_matrix.py",
        "sha256": "c3be6f49ed227643dc49dfac6d75f5f3626df6c7c45cb9b677ee2d93ac251a6f"
      },
      {
        "bytes": 4001,
        "git_blob": "3a9320d991dba39a348dea0b43cf974122537ff2",
        "git_mode": "100644",
        "path": "tools/gates/run_implementation_claim.py",
        "sha256": "f1754f72a93943b1e11fd838d920479474b9d1a59344bb1af9b5f9493872e44f"
      }
    ],
    "manifest_sha256": "c32c4466aa5deefab15fbe7d3da7e1c8a824d490d5396216964ef8e0c47e44a4",
    "source_revision": "8daf7dad6ad80554809dfe911cb54a8798533272",
    "source_tree": "92967ca0e8c0f2bbd5b3a2950bf220deb08dfdf8"
  }
}
